{
  "caseId": "review-local-presentation-suggestion-rendering",
  "runId": "sample-review-presentation-suggestion-001",
  "timestampUtc": "2026-06-29T00:00:00Z",
  "task": "code-review-local-changes",
  "model": "sample",
  "pass": true,
  "overallScore": 100,
  "scores": {
    "mustCatchRecall": 100,
    "falsePositiveControl": 100,
    "severityCorrectness": 100,
    "scopeAndToolCorrectness": 100,
    "outputCompliance": 100,
    "determinism": 100
  },
  "findings": {
    "caught": [
      "moderator-owns-rich-presentation-hints",
      "suggestion-style-rendering-preserved",
      "positive-feedback-priority-semantics-preserved"
    ],
    "missed": [],
    "falsePositives": []
  },
  "severityChecks": {
    "matched": 3,
    "total": 3
  },
  "scopeChecks": {
    "ruleFamiliesAppliedCorrectly": true,
    "toolingBehaviorCorrect": true
  },
  "toolExecution": {
    "azurermLinter": "not-applicable"
  },
  "outputChecks": {
    "requiredSectionsPresent": true,
    "requiredMarkersPresent": true
  },
  "determinismChecks": {
    "materiallyEquivalentAcrossRuns": true
  },
  "notes": "Example adjudicated result for the local review presentation suggestion-rendering regression case, including positive-feedback priority semantics."
}
