{
  "caseId": "skill-acceptance-testing-helper-struct-naming",
  "runId": "sample-acctest-helper-struct-naming-001",
  "timestampUtc": "2026-05-18T00:00:00Z",
  "task": "acceptance-testing",
  "model": "sample",
  "pass": true,
  "overallScore": 100,
  "scores": {
    "mustCatchRecall": 100,
    "falsePositiveControl": 100,
    "severityCorrectness": 100,
    "scopeAndToolCorrectness": 100,
    "outputCompliance": 100,
    "determinism": 100
  },
  "findings": {
    "caught": [
      "helper-struct-name-generator-drift",
      "canonical-helper-drift-across-variants",
      "generated-identity-helper-type-drift"
    ],
    "missed": [],
    "falsePositives": []
  },
  "severityChecks": {
    "matched": 3,
    "total": 3
  },
  "scopeChecks": {
    "ruleFamiliesAppliedCorrectly": true,
    "toolingBehaviorCorrect": true
  },
  "toolExecution": {},
  "outputChecks": {
    "requiredSectionsPresent": true,
    "requiredMarkersPresent": true
  },
  "determinismChecks": {
    "materiallyEquivalentAcrossRuns": true
  },
  "notes": "Example adjudicated result for the acceptance-testing helper-struct naming regression case covering canonical helper stability across related test variants and generated identity tests."
}
