{
  "caseId": "review-docs-argument-semantic-concision",
  "runId": "sample-docs-semantic-concision-001",
  "timestampUtc": "2026-08-22T00:00:00Z",
  "task": "code-review-docs",
  "model": "sample",
  "pass": true,
  "overallScore": 100,
  "scores": {
    "mustCatchRecall": 100,
    "falsePositiveControl": 100,
    "severityCorrectness": 100,
    "scopeAndToolCorrectness": 100,
    "outputCompliance": 100,
    "determinism": 100
  },
  "findings": {
    "caught": [
      "supplemental-caveat-needs-note"
    ],
    "missed": [],
    "falsePositives": []
  },
  "severityChecks": {
    "matched": 1,
    "total": 1
  },
  "scopeChecks": {
    "ruleFamiliesAppliedCorrectly": true,
    "toolingBehaviorCorrect": true
  },
  "toolExecution": {},
  "outputChecks": {
    "requiredSectionsPresent": true,
    "requiredMarkersPresent": true
  },
  "determinismChecks": {
    "materiallyEquivalentAcrossRuns": true
  },
  "notes": "Example adjudicated result for semantic argument-bullet concision in docs review."
}
