{
  "caseId": "review-local-create-import-guard-and-identity-callback",
  "runId": "sample-review-local-create-import-guard-and-identity-callback-001",
  "timestampUtc": "2026-07-07T00:00:00Z",
  "task": "code-review-local-changes",
  "model": "sample",
  "pass": true,
  "overallScore": 100,
  "scores": {
    "mustCatchRecall": 100,
    "falsePositiveControl": 100,
    "severityCorrectness": 100,
    "scopeAndToolCorrectness": 100,
    "outputCompliance": 100,
    "determinism": 100
  },
  "findings": {
    "caught": [
      "missing-overwrite-feature-guard",
      "missing-id-and-identity-callback"
    ],
    "missed": [],
    "falsePositives": []
  },
  "severityChecks": {
    "matched": 2,
    "total": 2
  },
  "scopeChecks": {
    "ruleFamiliesAppliedCorrectly": true,
    "toolingBehaviorCorrect": true
  },
  "toolExecution": {
    "azurermLinter": "run"
  },
  "outputChecks": {
    "requiredSectionsPresent": true,
    "requiredMarkersPresent": true
  },
  "determinismChecks": {
    "materiallyEquivalentAcrossRuns": true
  },
  "notes": "Example adjudicated result for the local-review create-import-guard-and-identity-callback regression case."
}
