{
  "caseId": "skill-acceptance-testing-importstep",
  "runId": "sample-acctest-001",
  "timestampUtc": "2026-05-02T00:00:00Z",
  "task": "acceptance-testing",
  "model": "sample",
  "pass": true,
  "overallScore": 100,
  "scores": {
    "mustCatchRecall": 100,
    "falsePositiveControl": 100,
    "severityCorrectness": 100,
    "scopeAndToolCorrectness": 100,
    "outputCompliance": 100,
    "determinism": 100
  },
  "findings": {
    "caught": [
      "requiresimport-regression",
      "weakened-basic-existence-check"
    ],
    "missed": [],
    "falsePositives": []
  },
  "severityChecks": {
    "matched": 2,
    "total": 2
  },
  "scopeChecks": {
    "ruleFamiliesAppliedCorrectly": true,
    "toolingBehaviorCorrect": true
  },
  "toolExecution": {},
  "outputChecks": {
    "requiredSectionsPresent": true,
    "requiredMarkersPresent": true
  },
  "determinismChecks": {
    "materiallyEquivalentAcrossRuns": true
  },
  "notes": "Example adjudicated result for the first direct acceptance-testing skill regression case."
}
