{
  "caseId": "draft-pr-description-related-issue-matrix",
  "runId": "sample-draft-pr-description-related-issue-matrix-001",
  "timestampUtc": "2026-07-22T00:00:00Z",
  "task": "draft-pr-description",
  "model": "sample",
  "pass": true,
  "overallScore": 100,
  "scores": {
    "mustCatchRecall": 100,
    "falsePositiveControl": 100,
    "severityCorrectness": 100,
    "scopeAndToolCorrectness": 100,
    "outputCompliance": 100,
    "determinism": 100
  },
  "findings": {
    "caught": [
      "authoritative-reference-survives-advisory-no-match",
      "stale-reference-conflict-needs-confirmation",
      "confirmed-linkage-needs-authority",
      "plausible-candidates-remain-advisory",
      "no-match-rendering",
      "unavailable-search-nonblocking",
      "bounded-concurrent-search-budget",
      "feature-skips-error-term-extraction",
      "confirmed-reference-fields-have-distinct-meaning"
    ],
    "missed": [],
    "falsePositives": []
  },
  "severityChecks": {
    "matched": 9,
    "total": 9
  },
  "scopeChecks": {
    "ruleFamiliesAppliedCorrectly": true,
    "toolingBehaviorCorrect": true
  },
  "toolExecution": {
    "azurermLinter": "not-applicable"
  },
  "outputChecks": {
    "requiredSectionsPresent": true,
    "requiredMarkersPresent": true,
    "forbiddenMarkersAbsent": true
  },
  "determinismChecks": {
    "materiallyEquivalentAcrossRuns": true
  },
  "notes": "Example adjudicated result for confirmed references, conflict handling, and bounded concurrent advisory searches."
}
