{
  "caseId": "review-committed-authoritative-status-signal-suppression",
  "runId": "sample-review-committed-authoritative-status-signal-suppression-001",
  "timestampUtc": "2026-07-07T00:00:00Z",
  "task": "code-review-committed-changes",
  "model": "sample",
  "pass": true,
  "overallScore": 100,
  "scores": {
    "mustCatchRecall": 100,
    "falsePositiveControl": 100,
    "severityCorrectness": 100,
    "scopeAndToolCorrectness": 100,
    "outputCompliance": 100,
    "determinism": 100
  },
  "findings": {
    "caught": [
      "authoritative-status-signal-rationale-applied"
    ],
    "missed": [],
    "falsePositives": []
  },
  "severityChecks": {
    "matched": 1,
    "total": 1
  },
  "scopeChecks": {
    "ruleFamiliesAppliedCorrectly": true,
    "toolingBehaviorCorrect": true
  },
  "toolExecution": {
    "azurermLinter": "run"
  },
  "outputChecks": {
    "requiredSectionsPresent": true,
    "requiredMarkersPresent": true
  },
  "determinismChecks": {
    "materiallyEquivalentAcrossRuns": true
  },
  "notes": "Example adjudicated result for the committed-review authoritative-status-signal-suppression regression case."
}
