{
  "caseId": "review-local-advocate-skip-no-candidates",
  "runId": "sample-review-advocate-skip-001",
  "timestampUtc": "2026-06-23T00:00:00Z",
  "task": "code-review-local-changes",
  "model": "sample",
  "pass": true,
  "overallScore": 100,
  "scores": {
    "mustCatchRecall": 100,
    "falsePositiveControl": 100,
    "severityCorrectness": 100,
    "scopeAndToolCorrectness": 100,
    "outputCompliance": 100,
    "determinism": 100
  },
  "findings": {
    "caught": [
      "advocate-skip-when-no-candidate-issues"
    ],
    "missed": [],
    "falsePositives": []
  },
  "severityChecks": {
    "matched": 1,
    "total": 1
  },
  "scopeChecks": {
    "ruleFamiliesAppliedCorrectly": true,
    "toolingBehaviorCorrect": true
  },
  "toolExecution": {
    "azurermLinter": "not-applicable"
  },
  "outputChecks": {
    "requiredSectionsPresent": true,
    "requiredMarkersPresent": true
  },
  "determinismChecks": {
    "materiallyEquivalentAcrossRuns": true
  },
  "notes": "Example adjudicated result for the local review advocate skip-path regression case."
}
