{
  "caseId": "review-local-advocate-dismissed-and-downgraded",
  "runId": "sample-review-advocate-outcomes-001",
  "timestampUtc": "2026-06-23T00:00:00Z",
  "task": "code-review-local-changes",
  "model": "sample",
  "pass": true,
  "overallScore": 100,
  "scores": {
    "mustCatchRecall": 100,
    "falsePositiveControl": 100,
    "severityCorrectness": 100,
    "scopeAndToolCorrectness": 100,
    "outputCompliance": 100,
    "determinism": 100
  },
  "findings": {
    "caught": [
      "advocate-dismissed-finding-observation",
      "advocate-downgraded-finding-stays-in-issues"
    ],
    "missed": [],
    "falsePositives": []
  },
  "severityChecks": {
    "matched": 2,
    "total": 2
  },
  "scopeChecks": {
    "ruleFamiliesAppliedCorrectly": true,
    "toolingBehaviorCorrect": true
  },
  "toolExecution": {
    "azurermLinter": "not-applicable"
  },
  "outputChecks": {
    "requiredSectionsPresent": true,
    "requiredMarkersPresent": true
  },
  "determinismChecks": {
    "materiallyEquivalentAcrossRuns": true
  },
  "notes": "Example adjudicated result for the local review advocate dismissed-versus-downgraded outcome regression case."
}
