{
  "caseId": "review-local-moderator-duplicate-merge-ready",
  "runId": "sample-review-moderator-duplicate-merge-001",
  "timestampUtc": "2026-06-29T00:00:00Z",
  "task": "code-review-local-changes",
  "model": "sample",
  "pass": true,
  "overallScore": 100,
  "scores": {
    "mustCatchRecall": 100,
    "falsePositiveControl": 100,
    "severityCorrectness": 100,
    "scopeAndToolCorrectness": 100,
    "outputCompliance": 100,
    "determinism": 100
  },
  "findings": {
    "caught": [
      "duplicate-routed-findings-merge-into-one-record",
      "strongest-evidence-survives-merge"
    ],
    "missed": [],
    "falsePositives": []
  },
  "severityChecks": {
    "matched": 2,
    "total": 2
  },
  "scopeChecks": {
    "ruleFamiliesAppliedCorrectly": true,
    "toolingBehaviorCorrect": true
  },
  "toolExecution": {
    "azurermLinter": "not-applicable"
  },
  "outputChecks": {
    "requiredSectionsPresent": true,
    "requiredMarkersPresent": true
  },
  "determinismChecks": {
    "materiallyEquivalentAcrossRuns": true
  },
  "notes": "Example adjudicated result for the live moderator duplicate-merge regression case."
}
