{
  "caseId": "skill-resource-implementation-list-resource",
  "runId": "sample-realcase-list-resource-001",
  "timestampUtc": "2026-05-04T00:00:00Z",
  "task": "resource-implementation",
  "model": "sample",
  "pass": true,
  "overallScore": 100,
  "scores": {
    "mustCatchRecall": 100,
    "falsePositiveControl": 100,
    "severityCorrectness": 100,
    "scopeAndToolCorrectness": 100,
    "outputCompliance": 100,
    "determinism": 100
  },
  "findings": {
    "caught": [
      "mandatory-list-resource"
    ],
    "missed": [],
    "falsePositives": []
  },
  "severityChecks": {
    "matched": 1,
    "total": 1
  },
  "scopeChecks": {
    "ruleFamiliesAppliedCorrectly": true,
    "toolingBehaviorCorrect": true
  },
  "toolExecution": {},
  "outputChecks": {
    "requiredSectionsPresent": true,
    "requiredMarkersPresent": true
  },
  "determinismChecks": {
    "materiallyEquivalentAcrossRuns": true
  },
  "notes": "Example adjudicated result for the resource-implementation list-resource workflow case."
}
