{
  "caseId": "skill-resource-implementation-custom-poller-migration",
  "runId": "sample-impl-custom-poller-001",
  "timestampUtc": "2026-05-06T00:00:00Z",
  "task": "resource-implementation",
  "model": "sample",
  "pass": true,
  "overallScore": 100,
  "scores": {
    "mustCatchRecall": 100,
    "falsePositiveControl": 100,
    "severityCorrectness": 100,
    "scopeAndToolCorrectness": 100,
    "outputCompliance": 100,
    "determinism": 100
  },
  "findings": {
    "caught": [
      "custom-poller-pattern-required",
      "preserve-polling-parity"
    ],
    "missed": [],
    "falsePositives": []
  },
  "severityChecks": {
    "matched": 2,
    "total": 2
  },
  "scopeChecks": {
    "ruleFamiliesAppliedCorrectly": true,
    "toolingBehaviorCorrect": true
  },
  "toolExecution": {},
  "outputChecks": {
    "requiredSectionsPresent": true,
    "requiredMarkersPresent": true
  },
  "determinismChecks": {
    "materiallyEquivalentAcrossRuns": true
  },
  "notes": "Example adjudicated result for the custom poller migration routing implementation-guidance case."
}
